ngram,count,per_million
in this paper we,1579,459.8
the performance of the,782,227.7
on the other hand,532,154.9
in the case of,517,150.6
in this section we,433,126.1
is the number of,430,125.2
with respect to the,408,118.8
is organized as follows,378,110.1
can be written as,375,109.2
paper is organized as,374,108.9
can be used to,372,108.3
is based on the,328,95.5
this paper we propose,309,90.0
can be expressed as,300,87.4
as shown in fig,298,86.8
performance of the proposed,288,83.9
the total number of,278,81.0
we assume that the,259,75.4
as well as the,257,74.8
in the presence of,257,74.8
is shown in fig,248,72.2
the size of the,248,72.2
can be found in,239,69.6
in terms of the,239,69.6
the output of the,238,69.3
it is possible to,235,68.4
in this work we,233,67.9
of this paper is,227,66.1
in this case the,227,66.1
in the context of,223,64.9
is de ned as,219,63.8
it can be seen,212,61.7
is assumed to be,207,60.3
db db db db,205,59.7
of the proposed method,196,57.1
as shown in figure,193,56.2
the paper is organized,193,56.2
the fact that the,192,55.9
as function of the,189,55.0
it can be shown,189,55.0
abstract in this paper,188,54.7
in this paper the,188,54.7
the length of the,187,54.5
and the number of,187,54.5
the variance of the,174,50.7
in the next section,173,50.4
this paper is organized,173,50.4
of the number of,172,50.1
the rest of the,170,49.5
are shown in fig,170,49.5
this work was supported,169,49.2
shown in fig the,168,48.9
can be shown that,167,48.6
of the proposed algorithm,167,48.6
where is the number,165,48.1
as follows in section,160,46.6
can be obtained by,157,45.7
can be seen that,156,45.4
results show that the,155,45.1
at the same time,154,44.8
organized as follows in,152,44.3
it is shown that,152,44.3
is given by the,150,43.7
this paper we present,147,42.8
the estimation of the,147,42.8
in the frequency domain,145,42.2
is shown in figure,143,41.6
organized as follows section,143,41.6
where and are the,143,41.6
it is assumed that,142,41.4
the parameters of the,138,40.2
the use of the,137,39.9
the results of the,136,39.6
for each of the,136,39.6
it is clear that,135,39.3
we can see that,134,39.0
as can be seen,134,39.0
as the number of,134,39.0
are assumed to be,134,39.0
if and only if,134,39.0
supported in part by,132,38.4
the proposed method is,132,38.4
the other hand the,129,37.6
is one of the,129,37.6
the difference between the,128,37.3
we are interested in,128,37.3
the quality of the,127,37.0
in the previous section,126,36.7
to the fact that,125,36.4
the accuracy of the,125,36.4
to the number of,123,35.8
show that the proposed,123,35.8
is due to the,122,35.5
the sum of the,121,35.2
work was supported by,121,35.2
it is easy to,121,35.2
it is important to,120,34.9
can be applied to,119,34.7
the value of the,119,34.7
in this paper is,119,34.7
the complexity of the,118,34.4
the effect of the,115,33.5
an estimate of the,114,33.2
the position of the,114,33.2
can be viewed as,114,33.2
can be used for,113,32.9
the proposed algorithm is,113,32.9
without loss of generality,112,32.6
is defined as the,112,32.6
the choice of the,111,32.3
in addition to the,110,32.0
in the following we,109,31.7
of the paper is,109,31.7
shown in figure the,108,31.5
proposed in this paper,108,31.5
with zero mean and,108,31.5
in the form of,107,31.2
block diagram of the,107,31.2
for the case of,107,31.2
the effectiveness of the,107,31.2
it has been shown,106,30.9
the structure of the,106,30.9
one of the most,106,30.9
this paper is to,105,30.6
are presented in section,105,30.6
the distribution of the,105,30.6
in the sense that,104,30.3
it is necessary to,103,30.0
due to the fact,103,30.0
can be achieved by,103,30.0
is the same as,102,29.7
are shown in table,102,29.7
the computational complexity of,102,29.7
in order to obtain,102,29.7
the case of the,101,29.4
the number of bits,100,29.1
is equal to the,100,29.1
can be considered as,100,29.1
this paper we have,100,29.1
evaluate the performance of,99,28.8
the order of the,99,28.8
in part by the,98,28.5
de ned as the,98,28.5
the distance between the,98,28.5
we show that the,97,28.2
are shown in figure,97,28.2
in order to reduce,97,28.2
can be seen in,97,28.2
to that of the,96,28.0
can be rewritten as,96,28.0
it is well known,95,27.7
we would like to,94,27.4
the dimension of the,93,27.1
it should be noted,93,27.1
referred to as the,92,26.8
we have shown that,92,26.8
was supported by the,92,26.8
is the set of,92,26.8
the ratio of the,92,26.8
at the end of,91,26.5
that the proposed method,91,26.5
results are shown in,90,26.2
the goal is to,90,26.2
be seen that the,89,25.9
was supported in part,89,25.9
can be seen as,88,25.6
presented in this paper,88,25.6
conclusion in this paper,88,25.6
follows in section we,87,25.3
rest of the paper,87,25.3
can be seen from,87,25.3
used to estimate the,86,25.0
the end of the,86,25.0
in other words the,86,25.0
is similar to the,86,25.0
is well known that,86,25.0
for the sake of,86,25.0
to be able to,85,24.8
is applied to the,85,24.8
processing vol no pp,85,24.8
conclusions in this paper,84,24.5
is referred to as,84,24.5
should be noted that,83,24.2
is related to the,83,24.2
signal to noise ratio,83,24.2
additive white gaussian noise,83,24.2
to evaluate the performance,82,23.9
we de ne the,82,23.9
is equivalent to the,81,23.6
in order to achieve,81,23.6
when the number of,81,23.6
the power of the,81,23.6
is de ned by,80,23.3
the center of the,80,23.3
in section we present,80,23.3
the case where the,80,23.3
the magnitude of the,80,23.3
than that of the,79,23.0
can be represented as,79,23.0
cos cos cos cos,79,23.0
the de nition of,78,22.7
at the output of,78,22.7
abstract this paper presents,78,22.7
standard deviation of the,78,22.7
the number of the,78,22.7
can be used as,78,22.7
the impulse response of,78,22.7
the values of the,78,22.7
this paper we consider,77,22.4
to the problem of,77,22.4
experimental results show that,77,22.4
the mean of the,77,22.4
are given in section,77,22.4
is used in the,76,22.1
can be interpreted as,76,22.1
the rest of this,76,22.1
that the number of,76,22.1
simulation results show that,76,22.1
the same as the,75,21.8
can see that the,75,21.8
improve the performance of,75,21.8
the fourier transform of,75,21.8
is assumed that the,74,21.6
order to reduce the,74,21.6
coef cients of the,74,21.6
results are presented in,73,21.3
the national science foundation,73,21.3
that can be used,73,21.3
the set of all,73,21.3
take into account the,73,21.3
the assumption that the,73,21.3
which is based on,73,21.3
with the number of,73,21.3
in the time domain,73,21.3
the computation of the,73,21.3
taking into account the,72,21.0
the next section we,72,21.0
the number of samples,72,21.0
we focus on the,72,21.0
our goal is to,72,21.0
the robustness of the,72,21.0
the number of users,72,21.0
on the number of,71,20.7
is determined by the,71,20.7
would like to thank,71,20.7
in this section the,71,20.7
as where is the,71,20.7
that the proposed algorithm,71,20.7
computational complexity of the,71,20.7
the standard deviation of,70,20.4
has been shown that,70,20.4
that the performance of,70,20.4
have been proposed in,70,20.4
be shown that the,70,20.4
the location of the,70,20.4
slp-p i- slp-p i-,70,20.4
is used as the,69,20.1
shown in fig and,69,20.1
this is due to,69,20.1
the number of iterations,69,20.1
rest of this paper,68,19.8
as described in section,68,19.8
automatic speech recognition asr,68,19.8
as shown in the,68,19.8
in the number of,68,19.8
is presented in section,67,19.5
used in this paper,67,19.5
for the purpose of,67,19.5
to improve the performance,67,19.5
and is the number,67,19.5
on the basis of,67,19.5
the covariance matrix of,67,19.5
of the proposed scheme,67,19.5
of the speech signal,66,19.2
probability density function pdf,66,19.2
is the total number,66,19.2
it is known that,66,19.2
the inverse of the,66,19.2
have been proposed for,66,19.2
in the absence of,65,18.9
the results show that,65,18.9
is the sum of,65,18.9
in the same way,65,18.9
can be approximated by,65,18.9
impulse response of the,65,18.9
the same number of,65,18.9
of the covariance matrix,65,18.9
does not depend on,64,18.6
is shown that the,64,18.6
real and imaginary parts,64,18.6
signal processing vol no,64,18.6
the solution of the,64,18.6
it can be observed,63,18.3
in order to improve,63,18.3
in order to avoid,63,18.3
are based on the,63,18.3
is given by where,63,18.3
the real and imaginary,63,18.3
the knowledge of the,63,18.3
the shape of the,62,18.1
by the national science,62,18.1
have been proposed to,62,18.1
this section we present,62,18.1
compare the performance of,62,18.1
ieee trans signal processing,62,18.1
in our previous work,61,17.8
reduce the number of,61,17.8
we propose to use,60,17.5
method is based on,60,17.5
that there is no,60,17.5
the probability density function,60,17.5
the statistics of the,60,17.5
this paper we focus,60,17.5
the energy of the,59,17.2
can be regarded as,59,17.2
the performance of our,59,17.2
the design of the,59,17.2
this means that the,59,17.2
can be represented by,59,17.2
is the vector of,59,17.2
in contrast to the,59,17.2
can be obtained from,59,17.2
this paper we will,59,17.2
the index of the,59,17.2
of the received signal,59,17.2
the calculation of the,58,16.9
it is observed that,58,16.9
section we describe the,58,16.9
has been shown to,58,16.9
independent component analysis ica,58,16.9
as long as the,58,16.9
by the number of,57,16.6
section we present the,57,16.6
performance in terms of,57,16.6
the phase of the,57,16.6
signal processing vol pp,57,16.6
to solve this problem,57,16.6
national science foundation under,57,16.6
by means of the,57,16.6
approach is based on,57,16.6
work was supported in,57,16.6
trans signal processing vol,57,16.6
not depend on the,56,16.3
in such way that,56,16.3
the in uence of,56,16.3
is clear that the,56,16.3
as compared to the,56,16.3
and it can be,56,16.3
of science and technology,56,16.3
ln ln ln ln,56,16.3
covariance matrix of the,56,16.3
by the fact that,55,16.0
in order to evaluate,55,16.0
is independent of the,55,16.0
the result of the,55,16.0
the maximum number of,55,16.0
have shown that the,55,16.0
loss of generality we,55,16.0
the likelihood of the,55,16.0
on the performance of,55,16.0
can be formulated as,55,16.0
paper we focus on,55,16.0
linear combination of the,55,16.0
fourier transform of the,55,16.0
consider the problem of,55,16.0
of the proposed approach,55,16.0
the probability that the,55,16.0
the behavior of the,55,16.0
and is given by,55,16.0
is described in section,54,15.7
as shown in table,54,15.7
at the beginning of,54,15.7
for the estimation of,54,15.7
it was shown that,54,15.7
the coef cients of,54,15.7
the presence of noise,54,15.7
the mean square error,54,15.7
the elements of the,54,15.7
ii ii ii ii,54,15.7
the properties of the,53,15.4
in this case we,53,15.4
described in section the,53,15.4
can also be used,53,15.4
is illustrated in figure,53,15.4
the solution to the,53,15.4
is proportional to the,53,15.4
the left and right,53,15.4
can be modeled as,53,15.4
institute of technology united,53,15.4
of technology united states,53,15.4
is added to the,52,15.1
of the input signal,52,15.1
from the fact that,52,15.1
is illustrated in fig,52,15.1
the characteristics of the,52,15.1
in the sense of,52,15.1
can be used in,52,15.1
paper we propose new,52,15.1
is function of the,52,15.1
it is shown in,52,15.1
than or equal to,52,15.1
at the cost of,52,15.1
this paper we use,52,15.1
effectiveness of the proposed,52,15.1
mean square error mse,52,15.1
results in this section,51,14.9
paper we propose an,51,14.9
in section we describe,51,14.9
the direction of the,51,14.9
the remainder of this,51,14.9
we note that the,51,14.9
let us consider the,51,14.9
independent and identically distributed,51,14.9
ch ch ch ch,51,14.9
de ned by the,50,14.6
principal component analysis pca,50,14.6
gaussian mixture model gmm,50,14.6
the evaluation of the,50,14.6
this research was supported,50,14.6
the derivative of the,50,14.6
we see that the,50,14.6
we observe that the,50,14.6
been proposed in the,50,14.6
the norm of the,50,14.6
of the algorithm is,50,14.6
at the expense of,50,14.6
state university united states,50,14.6
in this study we,49,14.3
it is based on,49,14.3
authors would like to,49,14.3
the performances of the,49,14.3
where the number of,49,14.3
of the cost function,49,14.3
the number of sources,49,14.3
the convergence of the,49,14.3
fig block diagram of,48,14.0
can be found by,48,14.0
hidden markov model hmm,48,14.0
for example in the,48,14.0
can be obtained as,48,14.0
be found in the,48,14.0
is used for the,48,14.0
this work has been,48,14.0
the authors would like,48,14.0
an extension of the,48,14.0
the relationship between the,48,14.0
the proposed approach is,48,14.0
that the use of,47,13.7
mean and covariance matrix,47,13.7
in the following section,47,13.7
under the assumption that,47,13.7
the results are shown,47,13.7
in the rest of,47,13.7
it is seen that,47,13.7
section concludes the paper,47,13.7
an example of the,47,13.7
are de ned as,47,13.7
bit error rate ber,47,13.7
slp-l i- slp-p i-,47,13.7
in the range of,46,13.4
in section in section,46,13.4
order to evaluate the,46,13.4
to deal with the,46,13.4
it is interesting to,46,13.4
the presence of the,46,13.4
the application of the,46,13.4
in this way the,46,13.4
is known to be,46,13.4
it is obvious that,46,13.4
on the use of,46,13.4
speech and signal processing,46,13.4
shows an example of,46,13.4
it can be easily,46,13.4
zero mean and variance,46,13.4
as follows section describes,45,13.1
the word error rate,45,13.1
we are able to,45,13.1
can be calculated by,45,13.1
amount of training data,45,13.1
increasing the number of,45,13.1
in the direction of,45,13.1
order to improve the,45,13.1
the state of the,45,13.1
the input signal is,45,13.1
the number of sensors,45,13.1
can be observed that,44,12.8
are listed in table,44,12.8
is then given by,44,12.8
can be reduced to,44,12.8
used to train the,44,12.8
are used in the,44,12.8
the average number of,44,12.8
to the best of,44,12.8
it is difficult to,44,12.8
can be written in,44,12.8
algorithm is based on,44,12.8
algorithms have been proposed,44,12.8
can be shown to,44,12.8
minimum mean square error,44,12.8
acoustics speech and signal,44,12.8
